Wikipedia movie ID,Summary,Movie release date,Classification
2573688,"In 1979, NASA scientist Dylan Hunt  is working on ""Project Ganymede"", a suspended animation system for astronauts on long-duration space flights. As chief of the project he volunteers for the first multi-day test. He places himself in chemically-induced hibernation deep inside Carlsbad Caverns; while there, his lab is buried in an earthquake. The monitoring equipment is damaged and fails to awake him at the intended end of the test. He awakens instead in 2133, emerging into a chaotic post-apocalyptic world. An event called ""The Great Conflict""  destroyed the civilization of Hunt's time. Various new civilizations have emerged in a struggle for control of available resources. Those with the greatest military might and the will to use it have the greatest advantage. Dylan Hunt is accidentally found and rescued by an organization calling themselves ""PAX"" . PAX members are the descendants of the NASA personnel who worked and lived at the Carlsbad Installation in Dylan's time. They are explorers and ""scientists"" who preserve what little information and technology survive from before the Conflict, and who seek to learn and acquire more in an effort to build a new civilization. Members of PAX find Dylan Hunt still sealed in the hibernation chamber. They revive him, and are thrilled to meet a survivor from before the Conflict. An elaborate ""Subshuttle"" subterranean rapid transit system was constructed during the 1970s, due to the vulnerability of air transportation to attack. The Subshuttles utilized a magnetic levitation rail system. They operated inside vactrain tunnels and ran at hundreds of miles per hour. The tunnel network was comprehensive enough to cover the entire globe. The PAX organization inherited the still-working system and used it to dispatch their teams of troubleshooters. In the area once known as Arizona and New Mexico a totalitarian regime known as the Tyranians rule the area. The Tyranians are mutants who possess greater physical prowess than non-mutated humans; they can be identified by their dual navels. Their leader discovers that Hunt has knowledge of nuclear power systems, and they offer him great rewards if he can repair their failing nuclear power generator. However, once he is in their power they attempt to force him to reactivate a nuclear missile system in their possession, with which they intend to destroy their enemies and dominate the region. Hunt is appalled by this small-scale replay of the events that must have led to the Conflict. He leads a revolt of the enslaved citizenry, sabotages the nuclear device, and destroys the reactor. To Hunt's dismay, the PAX leaders assert their pacifist nature and intentions. They are attempting to rebuild an idealistic society using all that was deemed ""good"" from Earth's past, and they regard Hunt's interference with a rival civilization and his destructive tactics as antithetical to this end. However, they also see great good in him and value his knowledge of the past. They ask Hunt to join PAX permanently but only if he can agree to never again take human lives. Hunt half-heartedly agrees. Security Chief Yuloff states that the rationale of taking lives to justify the saving of lives was what allowed ""The Great Conflict"" to happen in the first place.  The following are story concepts that were in development during the production of Genesis II that would have become individual episodes had the network approved the series. *""Company B"" - A ""Trojan Horse"" suicide squad from the days of the great conflict comes out of suspended animation and attacks PAX. They represent the 1995 A.D. ideal of a perfect soldier. *""London Express"" - A hair raising journey through submerged portions of the North Atlantic subshuttle tube to mysterious London of 2133 A.D. Dylan Hunt and Team-21 meet Lyra-A there and the mad monarch King Charles X. *""Robots Return"" - The advanced computers and sophisticated machinery left on a moon of Jupiter by a 1992 NASA expedition have evolved into a new form of robot life and visit Earth in search of the ""God"" which created their life. They meet Dylan Hunt, formerly of NASA and consider him a messiah. This story idea was later developed into the script for Star Trek: The Motion Picture, and, shares that work's thematic similarities to ""The Changeling"", written by John Meredyth Lucas. *""Poodle Shop"" - Dylan Hunt is captured and put on sale by the females in a strange society where men are treated as domestic pets and often traded back and forth for breeding purposes. This story idea would later turn into the second pilot, Planet Earth. *""The Apartment"" - Trapped inside 20th century ruins by a mysterious force field, Dylan Hunt is catapulted through a time continuum back to 1975 where he can be seen as a ""transparent ghost"" by the girl living in the apartment there. A bizarre love affair with a surprise twist ending. The basic plot appears later as an unused Star Trek: Phase II episode ""Tomorrow and the Stars"". *""The Electric Company"" - Dylan Hunt and his PAX team encounter a place where a strong priesthood holds a society in bondage through the clever use of electricity. The simple inhabitants see the flashes of light and the amplified voices as the sight and sound of ""God"", but Dylan's team ends the dominance of the priesthood when they come up with still better tricks. This episode superficially resembles the Star Trek episode ""Return of the Archons"". Source: - Lincoln Enterprises Catalog No. 6",1973,Yes
22442724,"Bill Schmidt and his long-term girlfriend Martha Wayne and their young son Hal live in a small Connecticut farmhouse owned by Martha's overbearing father. One snowy winter Sunday, two of Bill's ex-army buddies, Mike and Tony, arrive. A few years ago, they had all served together in Vietnam in the same platoon but later ended up on opposite sides of a court-martial. Bill has never told his girlfriend what happened in Vietnam or at the court-martial. The story slowly unfolds. Under orders in Vietnam not to take any prisoners, and faced with potentially hostile civilians who might attack them if left behind, Mike kills a civilian. Bill testifies against him and Mike is sent to the brig  for two years. He is angry. There is sexual tension between Mike and Martha. The tension builds and culminates in a fight and a rape.",1972,Yes
1892349,"A waste disposal company has a Russian nuclear bomb to transport, and an employee decides to save money by concealing it on a freight train. This train is also loaded with hazardous and flammable chemicals including metallic sodium which spontaneously ignites on contact with water. The train suffers a brake failure and becomes a runaway heading for Denver. John Seger, an NTSB investigator, boards the train and with the assistance of the railwaymen tries various ways to stop the train. Several ideas are tried, such as coupling a following train to the caboose , a derailing attempt  in which a helicopter narrowly avoids being hit, and finally, an attempt at manually activating the brakes . The final attempt works successfully, but is short-lived. The following rescue train, unaware of the freight's slowing, speeds forward and crushes the caboose . The force disengages the brakes, causing the train to speed up once again. Meanwhile, Denver residents are struggling to collect their families and then leave town, despite rioters and gridlock. Realizing that there is no way to stop it, John and the engineer  abandon the train by jumping off before it can speed up too much. The train derails and becomes a terrific wreck. Discovering the now highly unstable bomb on-board, firefighters struggle to put out the fire at the crash site. After realizing that metallic sodium is on the train, the firefighters and NEST teams retreat to evauluate a strategy. In the mean time, all fire fighting aircraft are grounded. The misinterpretation of a radio call to a water bombing helicopter leads it to dump its load of water onto the wreck. Water comes into contact with the metallic sodium, which explodes and in turn causes the nuclear bomb to detonate. The blast causes severe damage throughout Denver and releases an electromagnetic pulse. No cars work, electricity is down and anything with a computer is shut down. After the Blast, Denver lays in ruins, John then attempts to get his family out of Denver before nuclear fallout starts. After finding a working car, John eventully reunites with his family at a refugee camp in Kansas.",1999,Yes
4951286,"The time is the early-to-mid-1960s, the height of the Cold War between the United States and the Soviet Union. An unknown aircraft approaches North America from Europe. American bombers of the Strategic Air Command  are scrambled to their fail safe points near Russia. The bombers have orders not to proceed past their fail safe points without receiving a special attack code. The original ""threat"" is proven to be innocuous and recall orders are issued. However, due to a technical failure, the attack code is transmitted to Group Six, which consists of six Vindicator supersonic bombers and four escort fighters. Colonel Grady, the head of the group, tries to contact Omaha to verify the fail-safe order , but due to Soviet radar jamming, Grady cannot hear Omaha. Concluding that the attack order and the radar jamming could only mean nuclear war, Grady commands Group Six towards Moscow, their intended destination. At meetings in Omaha, the Pentagon, and in the fallout shelter of the White House, American politicians and scholars debate the implications of the attack. Professor Groteschele, who is loosely based on John von Neumann and Herman Kahn, suggests the United States follow this accidental attack with a full-scale attack to force the Soviets to surrender. The President orders the Air Force to send the four escort fighters after the bombers to shoot down the Vindicators. The attempt is to show that the Vindicator attack is an accident, not a full-scale nuclear assault. After using their afterburners in an attempt to catch the bombers the fighters run out of fuel and crash, dooming the pilots to die of exposure in the Arctic Sea. The fighters fail to destroy any bombers. The President of the United States contacts the Soviet premier and offers assistance in attacking the group. The Soviets decline at first; then they decide to accept help. Meanwhile, the Soviet PVO Strany air defense corps has managed to shoot down two of the six planes. After accepting American help they shoot down two more planes. Two bombers remain on course to Moscow. One is a decoy and carries no bombs. The other carries two 20 megaton devices. General Bogan tells Marshal Nevsky, the Soviet commander, to ignore the decoy plane because it is harmless. Nevsky, who mistrusts Bogan, instead orders his Soviet aircraft to pursue the decoy aircraft. The Russian fighters are then out of position to intercept the final American bomber. The decoy's feint guarantees that the remaining bomber can successfully attack. Following the failure, Nevsky collapses. As the bomber approaches Moscow, Colonel Grady opens up the radio to contact SAC to inform them that they are about to make the strike. As a last-minute measure, the Soviets fire a barrage of nuclear-tipped missiles to form a fireball in an attempt to knock the low-flying Vindicator out of the sky. The bomber shoots up two decoy missiles, which successfully leads the Soviet missiles high in the air and Colonel Grady's plane survives. With the radio open, the President attempts to persuade Grady that there is no war. Grady's son also attempts to convince him.  Understanding orders that such a late recall attempt must be a Soviet trick, Grady ignores them. Grady tells his crew that ""We're not just walking wounded, we're walking dead men,"" due to radiation from the Soviet missiles. He intends to fly the aircraft over Moscow and detonate the bombs in the plane. His co-pilot notes, ""There's nothing to go home to."" Meanwhile, the American president has ordered another American bomber to circle over New York City with 40-megaton payload, which should be dropped in case of the bombing of Moscow. The American ambassador in Moscow reports about the final moments of the Russian capital before being evaporated from the blast. The American bomber receives an order to drop its bombs over New York City in order for the destruction of Moscow to be vindicated and a Third World War avoided. It was earlier revealed that the American President's wife was in New York while the events of the film transpired, meaning she would be killed in the blast. The pilot of the American bomber, General Black , commits suicide with a lethal injection before hitting the target, knowing that his oblivious wife and little daughter are also down there.",2000,Yes
4266637,"It's January 1964 in the period when American troops were euphemistically termed ""military advisors"" in Vietnam. Major Asa Barker  has been given this command: a poorly-manned outpost named Muc Wa in rural Vietnam somewhere near the Da Nang to Phnom Penh  highway that a decade earlier had been the scene of a massacre of French soldiers during the First Indochina War. Barker is a weary infantry veteran in his third war , who provides veteran supervision to a cadre of advisors attached to a group of South Vietnamese who garrison the deserted village of Muc Wa.""Muc Wa"" is a real Special Forces base in the Plain of Reeds, southern Vietnam. The name is pronounced ""muc-hwa"", but spelled ""Muc Hoa"". Barker, as a seasoned officer, knows that he cannot defend his position due to lack of numbers and the quality of his local troops. He is still obliged to carry out the orders of his superior, General Harnitz , who sends Barker U.S. re-enforcements to appease him. His command consists of a handful of U.S. soldiers  and some reluctant former Vietnamese paddy farmers turned militiamen. Barker is a capable commander who has ended his career by having an affair with a senior officer's wife. He argues that the hamlet is deserted and has no importance, but sends a detachment from his command. The detachment is commanded by the brash but nervous Lt. Hamilton, and includes veteran sergeant Oleonowski, who is suffering from battle fatigue, a drug-addicted medic, Cpl. Lincoln, and a young draftee, Cpl. Courcey, who quickly befriends an elderly native volunteer, nicknamed ""Old Man"". On their way to Muc Wa along a dirt road, the column is ambushed at a roadblock, resulting in ARVN Cpl. Cowboy capturing and beheading the lone Viet Cong attacker. On reaching the hamlet, Hamilton sets up his defenses in a triangular formation and receives supplies brought in by helicopter. At the rear of the hamlet is a graveyard of 302 French soldiers with a placard above the entrance that reads, in French, ""Étrangers, dites aux Spartiates que nous demeurons ici par obéissance à leurs lois "", which refers to the Battle of Thermopylae. While he is investigating it, Courcey spots a one-eyed VC soldier, who is presumably a scout. Back at Barker's base, Barker receives a Psy-ops officer who claims that he will be able to predict which one of Barker's outposts the VC will attack next. During the following night Muc Wa is attacked by the VC, sustaining its first casualty when Lt. Hamilton is killed along with a few South Vietnamese soldiers. The next day, Sgt Oleonowski commits suicide rather than face the pressure of command. When Barker is informed of the deaths, he wants to pull his troops out now that they lack an experienced leader, but this request is refused by Harnitz, forcing Barker to send his own deputy to Muc Wa. When the psy-ops man predicts Muc Wa will be attacked, Barker contacts them by radio only to learn that they're under attack from the Viet Cong. True to Barker's predictions, the outpost is overwhelmed by the massive numbers of Viet Cong who number in the many thousands, not the few hundred predicted by the high command, and they are all well armed with various automatic weapons, not outdated rifles. Barker is order by Harnitz to withdraw the American troops, leaving behind the South Vietnamese troops, including the walking wounded. The idealistic Courcey refuses to leave the wounded, so Barker stays behind with him to help evacuate the remaining South Vietnamese troops and militiamen. This leaves Barker, Courcey, the Old Man and his fellow South Vietnamese militiamen at Muc Wa, and in the ensuing battle almost everyone is killed, including Barker who had stayed behind to cover their escape. The only American survivor is ironically the willing volunteer, Courcey, whose idealism and enthusiasm for the Vietnam War has now been killed along with all his comrades. He wakes up after the battle in the morning to find that everyone else is dead and the soldiers, including Barker, are stripped of their fatigues. The VC have withdrawn having left him for dead. As Courcey wanders to the grave site, he finds another survivor: the wounded, one-eyed VC scout that he saw earlier. The VC points his rifles at Courcey before dropping it out of exhaustion. Courcey says to the one-eyed VC, ""I'm going home, Charlie, if they'll let me"" as he wanders off the grave site.",1978,Yes
1556135,"On a cruise ship en route to Copenhagen, Michael Armstrong , an esteemed American physicist and rocket scientist, is to attend a scientific conference. Once there, he begins acting suspiciously, eventually flying to East Berlin, where he is welcomed by representatives of the East German government. His assistant and fiancée, Sarah Sherman , follows him there, believing he has defected to the other side. Sherman, however, is extremely uncomfortable with this move, realizing if the apparent defection is in fact real, given the circumstances of the Cold War of the period, she would likely never see her home or family again. They are constantly accompanied by Professor Karl Manfred , who took part in arranging Armstrong's defection to the East. It soon becomes apparent to the viewer that Armstrong's defection is in fact a ruse to gain the confidence of the East German scientific establishment, in order to learn just how much their chief scientist Gustav Lindt  and by extension, the Soviet Union, knows about anti-missile systems. Armstrong has made preparations to return to the West. These plans are threatened, along with the entire escape network, known as Pi, when he is followed to the isolated farm home of his contact by Hermann Gromek , an East German security officer assigned to him. Armstrong kills Gromek, who is then buried by the 'farmer'  and his wife . The taxicab driver  who drove Armstrong to the farm, however, reports Armstrong's suspicious behavior to the police. Armstrong visits the physics faculty of Karl Marx University in Leipzig, where his loyalty is suspected because of the missing Gromek. The faculty try to interrogate his fiancée/assistant about her knowledge of the American ""Gamma Five"" anti-missile program, but she refuses to cooperate and runs from the room. At this point, Armstrong secretly confides to her his actual motives, and asks her to go along with the ruse. He finally goads Professor Lindt into revealing his anti-missile equations in a fit of pique over what Lindt believes are Armstrong's mathematical mistakes. When Lindt hears over the university's loudspeaker system that Armstrong and his fiancée are being sought for questioning, he realizes that he has given up his secrets while learning nothing in return. Armstrong must make a harrowing escape, along with Sherman, with the help of the university clinic physician Dr. Koska . They travel to East Berlin, pursued by the Stasi, in a bus operated by the Pi escape network, led by Mr. Jacobi . Roadblocks, highway robbery by Soviet army deserters, and bunching with the real bus increase the suspense. The escape eventually leads to an alliance with the exiled Polish countess Kuchinska , and a typical Hitchcock setpiece, an escape through a crowded theater after being spotted by the lead ballerina , who bears a bit of a grudge.  Armstrong and Sherman hide in a crate of props belonging to a traveling Czech troupe. The troupe travels across the Baltic Sea to Sweden on a freighter. The ballerina makes a mistake in uncovering where Armstrong and Sherman are hiding on the ship, the wrong crates are fired on when already dangling over the pier, and Armstrong and Sherman are able to escape by jumping overboard and swimming to a Swedish dock.",1966,Yes
2372989,"Recent high school graduate Samantha Hughes, 17, lives in fictional Hopewell, Kentucky with her uncle Emmett Smith, a laid-back Vietnam veteran with post-traumatic stress disorder. Samantha's father, Dwayne, was killed in Vietnam at 21 after marrying and impregnating Samantha's mother, Irene. Samantha finds some old photographs, medals, and letters of her father, and becomes obsessed with finding out more about him. Irene, who has moved to Lexington, Kentucky with her second husband, wants Samantha to move in with them and go to college. But Samantha would rather stay with Emmett and try to find out more about her father. Her mother is no help, as she tells Samantha, ""Honey, I married him a month before he left for the war. He was 19. I hardly even remember him."" Finally, Samantha, Emmett and her grandmother visit the Vietnam Veterans Memorial in Washington, D.C. Finding her father's name in the memorial releases cathartic emotions in Samantha and her family.",1989,Yes
