Wikipedia movie ID,Summary,Movie release date,Classification
10705512,"The story is set in a then-future 1964, in the months following World War III. The conflict has devastated the northern hemisphere, polluting the atmosphere with nuclear fallout and killing all life. While the bombs were confined to the northern hemisphere, air currents are slowly carrying the fallout south. The only areas still habitable are in the far southern hemisphere, like Australia. From Australia, survivors detect an incomprehensible Morse code signal from San Diego in the United States. In the hope that someone is still alive back home, the last American nuclear submarine, USS Sawfish, under Royal Australian Navy command, is ordered to sail north from Melbourne to try to make contact with the signal sender. The captain, Dwight Towers , leaves behind his good friend, the alcoholic Moira Davidson , despite his feelings of guilt about the deaths of his wife and children in Connecticut. Towers refuses to admit they are dead and continues to behave accordingly. The Australian government arranges for its citizens to receive suicide pills and injections, so that they may end things quickly before there is prolonged suffering from the inevitable radiation sickness. An Australian naval officer, Peter Holmes , and his naive and childish wife, Mary , who is in denial about the impending disaster, have a baby daughter. Assigned to travel with the American submarine for several weeks, Peter tries to explain to Mary how to euthanize their baby and kill herself with the lethal pills in case he's not yet home when the time comes. Mary reacts violently at the prospect of killing her daughter and herself. One scientist's theory is that the radiation level near the Arctic Ocean could be lower than that found at mid-northern hemisphere. If so, this would indicate the radiation could disperse before reaching the southern hemisphere. This was to be explored along with the submarine's main mission. After sailing to Point Barrow, Alaska, they determine that radiation levels are, on the contrary, intensifying. The submarine next stops at San Francisco. The views through the periscope show no signs of life and no damage to buildings. One crewman jumps ship to spend his last days in his hometown. After attempting to convince the crewman to return, Towers accepts his decision. The crewman is last seen fishing as the Sawfish submerges. Sawfish then travels to an abandoned oil refinery in San Diego, where they discover that despite the fact that everyone is dead, the hydroelectric power station is still operating. The ship's communications officer is sent ashore in a radiation suit to investigate. The mysterious signal is the result of a Coca Cola bottle being bumped by a window shade fluttering in the breeze and tapping a telegraph key. Bitterly disappointed, the submariners return to Australia to live out the remaining time before the nuclear fallout reaches their shores. They do their best to enjoy what time and pleasures remain to them before dying. Scientist Julian Osborn  and others organize a wild motor race, the ""Australian Grand Prix"", in which all participants die in accidents except Osborn, at the wheel of his vintage Ferrari. Moira only sees the senselessness of the race, but when she asks Osborn why he is taking part, he responds, ""because I want to"". Prior to the submarine voyage to America, Towers told Moira about how he enjoys relaxing by fishing. During his absence, Moira gets the fishing season set earlier so Dwight will get one last chance to fish. With Towers now accepting the death of his family, they embark on a weekend trip. Retreating to the resort for the night, Dwight and Moira share a romantic interlude inside their room as outside a gathering storm howls. Returning to Melbourne, Towers is told one of his crew has developed radiation sickness. The deadly radiation has arrived. Some citizens seek spiritual guidance from the Salvation Army. They hang a banner from the public library stating that ""There Is Still Time… Brother"". Osborn, proud and satisfied after winning the ""Australian Grand Prix"", seals himself and the car, engine running, inside a garage to end his life by carbon monoxide poisoning. Others line up to receive their suicide pills. Later, Mary Holmes  becomes emotionally unbalanced and must be placed under sedation. She regains lucidity, and she and Peter share a tender moment together before Mary decides that she has been ""foolish and impractical"" and asks her husband to ""take care"" of her and their daughter. ""I'd like that cup of tea now,"" she tells him. Dwight wants to stay with Moira, but his remaining crew want to head for home and die in the United States. In the end, Commander Towers chooses not to stay but rather to lead his crew back to the States. Moira watches from the shore as the Sawfish submerges beneath the waves. The end shows the deserted, abandoned streets of Melbourne. The last shot, punctuated by emphatic music, is of the ""There Is Still Time… Brother"" banner.  *Nevil Shute was displeased with the final cut of the film, feeling that too many changes had been made at the expense of the story's integrity. Gregory Peck agreed with him, but, in the end, producer/director Stanley Kramer's ideas won out. *In the novel, there are people still alive elsewhere in the Southern Hemisphere, and Australia is in radio contact with other places such as Montevideo and Cape Town. Commander Towers is in communication with the only other remaining active-duty U.S. Navy vessel: another submarine, USS Swordfish, which has been on duty in the Atlantic and, at the end, is based in Montevideo. Melbourne, where much of the novel is set, is the southernmost major city in the world and so will be the last such to go, but people in New Zealand, Tierra del Fuego and other, more southerly points are said to have a few additional weeks left to them. In the film, an unidentified radio newscaster says that, as far as is known, Australia is home to the last human life on the planet, and there is no USS Swordfish. *In the novel, the submarine is named Scorpion. In the film, she is called Sawfish. This may be because there was an actual USS Scorpion under construction at the time the film was made. A nuclear submarine like her fictional counterpart, USS Scorpion was in service from 1960 to 1968, when she was lost with all hands, cause unknown. *The novel describes Moira Davidson as a slender, petite pale blonde in her mid-twenties. In the film, she is portrayed by the tall, curvaceous, 37-year-old brunette Ava Gardner. *A naval training base near Seattle is the location in the novel where the strange Morse signals are detected. The film uses an oil refinery in San Diego as its location. *Buildings in San Francisco are shown as undamaged in the film, while in the novel the city has been largely destroyed and the Golden Gate Bridge has fallen *The northernmost point of the submarine's journey in the novel is the Gulf of Alaska, while the film uses Point Barrow. In reality, ice cover would have made it impossible for the submarine to surface off Point Barrow. *The nuclear scientist in the book is named John Osborne, a twenty-something bachelor. In the movie, he is portrayed by 60-year old Fred Astaire and is named Julian Osborn. The first name may have been changed and the surname spelled differently in the film to avoid any unintended reference to contemporary English playwright John Osborne. *Moira Davidson and John Osborne are cousins in the novel, but Moira Davidson and Julian Osborn are former lovers in the film. *Admiral Bridie and his secretary, Lieutenant Hosgood, are in the film but not in the novel. *Moira and Dwight never sleep together in the novel; Dwight remains faithful to the memory of his wife. Moira, though disappointed at first, comes to respect his stance. Film director Stanley Kramer believed that audiences would not believe that Dwight, as played by Peck, could resist the charms of sex symbol Gardner, so a love scene was inserted. Shute disliked this change to his original storyline. *The novel ends with a dying Moira sitting in her car, taking her suicide pills, while watching Scorpion head out to sea to be scuttled. Unlike the book, no mention of scuttling the sub is made in the film; instead Commander Towers's crew asks that he try to take them home to the United States, where they can die on their home soil. Although he realizes that they probably will not survive the passage, he does as they request. In the film, Ava Gardner is seen merely watching Dwight's submarine disappear and is not seen to commit suicide at that time. *Unlike the novel, no blame is placed on whoever started the war; it is hinted that it may have been an accident, a few faulty vacuum tubes, or transistor circuits as in the similarly themed film Fail-Safe . *Dwight and Moira do not attend the ""Australian Grand Prix"" in the novel, unlike in the film. This was because they were vacationing in the mountains that day. However, during a radio news broadcast, they hear about John Osborne's first-place victory.",1959,Yes
113460,"In 1967, Chris Taylor  has dropped out of college and volunteered for combat duty in Vietnam. Assigned to Bravo Company, near the Cambodian border, he is worn down by the exhausting conditions and his enthusiasm for the war wanes. One night his unit is set upon by a group of North Vietnamese Army  soldiers, who retreat after a brief gunfight. New recruit Gardner is killed while another soldier, Tex, is maimed by friendly fire from a grenade thrown by Sergeant ""Red"" O'Neill , with Taylor being mistakenly reprimanded by the ruthless Staff Sergeant Bob Barnes . Taylor eventually gains acceptance from a tight-knit group in his unit who socialize and even use drugs in a cabin clubhouse. He finds a mentor in Sergeant Elias  as well as the elder King . During one patrol, a soldier named Manny is found mutilated and tied to a post while two others, Sal and Sandy, are killed by a booby-trap. As tension mounts, the platoon soon reaches a nearby village where a supply cache is discovered. Taylor finds a disabled young man and an elderly woman hiding in a spider hole. Taylor snaps, screaming and threatening the man but is shocked to see Bunny  then bludgeon him to death. Barnes interrogates the village chief to determine if they have been aiding the Vietcong. Despite the villagers' adamant denials, Barnes shoots and kills the chief's wife due to her persistent arguing. Barnes takes the child of the woman at gunpoint, threatening to shoot her if the villagers do not reveal information. Elias arrives, scolding Barnes and engaging in a scuffle with him over the incident. Platoon commander Lieutenant Wolfe  orders the men to leave with the villagers and burn the village. As they leave, Taylor stops a group of soldiers raping two girls. Upon returning to base, Captain Harris  warns that if he finds out an illegal killing took place, then a court-martial would be ordered, which concerns Barnes as Elias might give a testimony. On their next patrol, the platoon is ambushed and pinned down in a firefight, in which numerous soldiers are wounded. Wolfe calls in an artillery strike on incorrect coordinates, resulting in friendly fire casualties. Elias takes Taylor and Rhah  to intercept flanking enemy troops. Barnes orders the rest of the platoon to retreat, and goes back into the jungle to find Elias' group. Barnes finds Elias and shoots him, returning to tell the others that Elias was killed by the enemy. After they take off, a wounded Elias emerges from the jungle, running from a group of North Vietnamese soldiers. Taylor glances over at Barnes and reads the apprehension on his face as Elias dies. At the base, Taylor attempts to talk his group into retaliation when a drunken Barnes enters the room and taunts them. Taylor attacks him but is cut near his eye as a result. The platoon is sent back into the combat area to maintain defensive positions. King is sent home and Taylor shares a foxhole with Francis . That night, an NVA assault occurs and the defensive lines are broken. Several soldiers in the platoon including Junior, Bunny and Wolfe, are killed, while O'Neill barely escapes death by hiding under a dead soldier. To make matters worse, an NVA sapper armed with explosives rushes into battalion HQ, self-detonating and killing everyone inside. Meanwhile, Captain Harris orders his air support to expend all remaining ordnance inside his perimeter. During the chaos, Taylor encounters Barnes, but the wounded sergeant attacks him. Just before Barnes can pummel Taylor, both men are knocked unconscious by an explosion. Taylor regains consciousness the following morning, picks up an enemy Type 56, and finds an injured Barnes, who dares him to pull the trigger. Taylor shoots Barnes, killing him. Taylor then considers suicide with a grenade before reinforcements arrive and find him. Francis, who survived the battle unharmed, deliberately stabs himself in the leg and reminds Taylor that because they have been twice wounded, they can return home to the U.S. O'Neill, who desperately wants to go home, is told he will remain in duty and replace Barnes. The helicopter flies away and Taylor weeps as he stares down at the death and destruction.",1986,Yes
123464,"The genesis of the movie arises out of the Cold War tensions existing between the United States and the Soviet Union during the early 1960s. The film presents a dramatic account of a series of coincidental events leading up to an accidental thermonuclear first-strike attack by a group of United States “Vindicator” bombers  against Moscow, the capital of what was then the Soviet Union. Amidst an ordinary tour for VIPs at the U.S. headquarters of the Strategic Air Command  in Omaha, Nebraska, an alert is initiated when SAC radar indicates an intrusion into American airspace of an unidentified flying object. The standard procedure of SAC is to keep several groups of bombers constantly flying around the clock as a most immediate response to any potential nuclear attack on the country. Upon any initial alert from headquarters, these airborne groups proceed to pre-identified aerial points around the globe called ""fail-safe points"" to await an actual ""go code"" before proceeding towards Russian targets. Shortly after reaching those points, the flying object is identified merely as an off-course airliner and the alert is canceled. However, a technical error sends an errant ""go code"" to a group of bombers, ordering them to proceed and attack their target. Coincidentally and simultaneously, a new Russian jamming device begins radio jamming of communications between SAC headquarters and the bomber group with the result that the group commander, Colonel Jack Grady , begins to lead the attack on Moscow. Pressure mounts as the President of the United States  and his advisers attempt to recall the group or shoot them down. Communications are begun with the Soviet Chairman, whereupon mistakes on both sides  are acknowledged. The jamming is reversed; however, SAC training and protocols cause the crew to reject counter-orders to abort the mission. Upon confirmation regarding the completion of the accidental attack on Moscow, the President realizes the severity of the situation and seeks a resolution to the matter that will avoid reprisal from the Russians and, ultimately, an all-out nuclear holocaust. With this threat in mind, the President orders an immediate similar nuclear strike on New York City.",1964,Yes
1129041,"In October 1962, U-2 surveillance photos reveal that the Soviet Union is in the process of placing missiles carrying nuclear weapons in Cuba. These weapons have the capability of wiping out most of the Eastern and Southern United States in minutes if they become operational. President John F. Kennedy  and his advisers must come up with a plan of action to prevent their activation. Kennedy is determined to show that the United States will not allow a missile threat in its virtual back yard. The Joint Chiefs of Staff advise immediate U.S. military strikes against the missile sites followed by an invasion of Cuba. However, Kennedy is reluctant to attack and invade because it would very likely cause the Soviets to invade Berlin. Citing The Guns of August, Kennedy sees an analogy to the events that started World War I, where the tactics of both sides commanders had not evolved since the previous war and were obsolete, only this time nuclear weapons are involved. War appears to be almost inevitable. The Kennedy administration tries to find a solution that will remove the missiles but avoid an act of war. They settle on a step less than a blockade, which is formally regarded as an act of war. They settle on what they publicly describe as a quarantine. They announce that the U.S. Naval forces will stop all ships entering Cuban waters and inspect them to verify they are not carrying weapons destined for Cuba. The Soviet Union sends mixed messages in response. John A. Scali, a reporter with ABC News, is contacted by Soviet ""emissary"" Aleksandr Fomin , and through this back-channel communication method the Soviets offer to remove the missiles in exchange for public assurances from the U.S. that it will never invade Cuba. A long message in the same tone as the informal communication from Fomin, apparently written personally by Soviet Premier Nikita Khrushchev, is received. This is followed by a second, more hard line cable in which the Soviets offer a deal involving U.S removal of its Jupiter missiles from Turkey. The Kennedy administration interprets the second as a response from the Politburo, and in a risky act, decides to ignore it and respond to the first message, assumed to be from Khrushchev. There are several mis-steps during the crisis: the defense readiness level of Strategic Air Command  is raised to DEFCON 2 , without informing the President; a nuclear weapon test proceeds  and a routine test launch of a U.S. offensive missile is also carried out without the President's knowledge. After much deliberation with the Executive Committee of the National Security Council, Kennedy secretly agrees to remove all Jupiter missiles from southern Italy and in Turkey, the latter on the border of the Soviet Union, in exchange for Khrushchev removing all missiles in Cuba. Off the shores of Cuba, the Soviet ships turn back from the quarantine lines. Secretary of State Dean Rusk  says, ""We're eyeball to eyeball and I think the other fellow just blinked.""",2000,Yes
226682,"The story is presented as a flashback of Max Eriksson , a Vietnam veteran. In November 1966, a squad of American soldiers is on patrol when they are suddenly attacked by the Viet Cong. The ground cracks under Eriksson while he walks above a Viet Cong tunnel, and he is stuck in the hole while mortar shells land near him. Unknown to him, a Viet Cong soldier in the tunnel below him prepares to silently kill him with a knife. Sergeant Tony Meserve  hears Eriksson, pulls him out of the hole, and shoots the Viet Cong soldier dead. Eventually, the Americans stave off the attack. The squad takes a break outside a river village in the Central Highlands. While relaxing and joking around, one of the squad members, SPC 4 ""Brownie"" Brown  is shot in the neck by Viet Cong across the river. The squad kills several enemies until they realize there's Viet Cong running through a flooded field behind them. One throws a grenade at Eriksson, but in a miraculous shot he blows up the grenade in mid-air with his M-79 grenade launcher. Brownie is evacuated but Meserve later informs the squad that he died at the hospital. Shortly afterward, Private Antonio Diaz  arrives as Brownie's replacement. The unit is then re-deployed to a nearby village, which is believed to be an ally to the Viet Cong. Because of their reassignment, the unit has their leave time cut short. Frustrated because his squad has been denied leave for an extended period, Meserve orders the squad to kidnap a Vietnamese girl, Than Thi Oanh , to be their sex slave. Eriksson strenuously objects, but Meserve silences him and ostracizes him from the rest of the squad. The girl is forcibly taken to the squad's next command outpost and is repeatedly beaten and raped by all the men but Eriksson. Oanh grows ill and develops a persistent cough. The squad is later ordered to take up a position near a railroad bridge overlooking a Viet Cong river supply depot. Meserve and Corporal Thomas E. Clarke  realize Oanh's coughing might give them away. Meserve has Diaz order air support for an assault on the depot, then orders Eriksson to kill Oanh. Eriksson staunchly refuses despite Meserve's death threats. Clarke looks out in the sky and sees a unit of Huey helicopters passing a mountain and then turning towards their position. Fearing the helicopters will somehow see their rape victim, Meserve first orders PFC Herbert Hatcher  to kill Oanh, but Hatcher begs Meserve not to, so then Meserve orders Diaz. Before Diaz can kill her, Eriksson fires his M-16 rifle into the air, exposing them to the nearby Viet Cong. As the battle rages, Eriksson, who is carefully picking off Viet Cong hiding behind a supply sampan on the river bank, doesn't realize that Clarke has brutally stabbed Oanh more than twice with his knife. Things become desperate when the Viet Cong move mortars up to the river and begin lobbing shells onto the bridge trapping the squad. Fortunately, Meserve is able to kill many of the enemy with his M-60 machine gun. In the midst of the firefight Oanh, whose wounds were not immediately fatal, walks onto the bridge to try to escape. Eriksson charges at her, trying to catch her but is stopped by Meserve, who knocks Eriksson down with the butt of his M-60. Eriksson watches helplessly as the entire squad shoots Oahn numerous times until she falls off the bridge, dead. The helicopter gunships then strafe the supply depot with rockets blowing it up but accidentally setting a passing U.S. Navy River Patrol Boat  on fire when the sampan explodes, killing all the crewmen. After the battle, Eriksson wakes up in a hospital. Meserve and the squad cover up the murder but Eriksson refuses to let the secret die. He jeopardizes both his life and military career  to expose the crime. Eventually, an attempt on Eriksson's life is made by Clarke, who tries to kill Eriksson while he is using the latrine. Eriksson takes action by confronting Meserve and his men, and using a shovel, strikes Clarke across the face, scaring the rest of the men and informing Meserve that he ""told everyone and they don't care"", Meserve calls him ""dinky dow""  before Eriksson exits the tent. Eriksson meets a chaplain at the bar and tells him the story of the girl. There is an investigation and the four men who participated in the rape and murder are court martialed: Meserve receives ten years hard labor and a dishonorable discharge, Clarke is sentenced to life in prison, Private Herbert Hatcher receives fifteen years hard labor, Diaz receives eight years hard labor. As the four exit the court room, Meserve whispers something in Eriksson's ear, most likely a threat suggesting what Meserve might do to Eriksson once he is free from the stockade. At the end of the movie, Eriksson wakens from a nightmare (apparently a [[Flashback  to find himself on a MUNI J-Church in San Francisco, just a few seats from a Vietnamese-American student  who resembles the murdered girl. She disembarks at Dolores Park and forgets her scarf, and Ericksson runs after her to return it. As she thanks him and turns away, he calls after her in Vietnamese. She surmises that she reminds him of someone, and adds, ""You had a bad dream, didn't you? It's over now, I think. Chào Ông [as a response to his greeting to her 'Chào Cô' in Vietnamese]."" They go their separate ways, Eriksson somewhat comforted.",1989,Yes
