Wikipedia movie ID,Summary,Movie release date,Classification
4562945,"The film takes place in the town of Paradise, Arizona , where the volatile Postal Dude, after being mocked at a job interview, kicked out of his local unemployment office and discovering that his morbidly obese wife is cheating on him, is more than a little angry and is desperate to get enough cash to finally leave his dead-end town. He decides to team up with his Uncle Dave, a slovenly con artist turned doomsday cult leader who owes the US government over a million dollars in back-taxes. With the help of Uncle Dave's right hand man Richie and an army of big-breasted, scantily clad cult members, the Dude devises a plan to hijack a shipment of 2,000 Krotchy Dolls, a rare, sought-after plush toy resembling a giant scrotum. Uncle Dave plans to sell them online, where their prices have reached as high as $4,000 a doll. Unbeknownst to them, Osama bin Laden and his group of Al-Qaeda terrorists, who had been secretly hiding in Paradise since September 11, under the watchful eye of bin Laden's best friend George W. Bush, are after the same shipment, but for entirely different reasons. Hoping to outdo the catastrophe of 9/11, they plan to instill the dolls with Avian influenza and distribute them to unsuspecting American children. The two groups meet at the shipment's destination, Nazi-themed amusement park Little Germany. A fight between Postal creator Vince Desiderio and Postal director and park owner Uwe Boll , sparks a massive shootout between the cult, the terrorists and the police, resulting in the deaths of dozens of innocent children. The Dude and the cult are able to get away with both the shipment and the park's opening day guest, Verne Troyer, pursued by Al-Qaeda, the police and a mob of angry citizens. Upon returning to their compound, which has been overtaken by the terrorists, the Dude, Uncle Dave and the rest covertly sneak into the compound's underground bunker, where Richie reveals that he must now fulfill the prophecy foretold in Uncle Dave's fictional Bible: to bring about the extinction of the human race. As per Uncle Dave's Bible, the event initiating the apocalypse is the rape of a ""tiny entertainer"" by a thousand monkeys. After Verne Troyer is quickly thrown into a pit of chimpanzees, Richie shoots and kills Uncle Dave, then imprisons the Dude. The Dude manages to escape the compound with a plethora of weapons, deciding to wage a one-man war against al-Qaeda, his uncle's murderer, his cheating wife, the police and the many people who want him dead. On the way to his trailer , he meets up with an attractive young barista, Faith, who joins forces with him after an explosive gunfight followed later by The Dude's heartfelt but futile monologue about war. The two of them then proceed to kill all the terrorists, all the bloodthirsty townspeople, the remains of the now-mad cult, his wife, and her multiple lovers. In the midst of the shootout, bin Laden escapes to a payphone, where he calls Bush for help. Bush sends a helicopter to save him and plans for the two to rendezvous. Having won their war, the Dude, his dog and the barista drive away in a stolen police car. They casually turn on the radio, only to learn that Bush has blamed the day's shootouts and explosions on China and India, and has been ""forced to destroy both countries with nuclear force"". China, in retaliation, has unleashed 30 nuclear missiles towards America, which are scheduled to hit in under two minutes. The film's final shot features Bush and bin Laden skipping through a field together, hand-in-hand. As mushroom clouds explode on the horizon, bin Laden laughs and says, ""Georgie, I think this is the beginning of a beautiful friendship"". At that moment, all of the nuclear missiles hit, and the country is destroyed.",2007,Yes
8995918,"During the 1962 Cuban missile crisis, teachers at a secluded countryside elementary school are asked to walk their pupils home after a nuclear bomb warning alarm sounds. Unaware that the alarm was tripped by accident, the teacher and children walk through the countryside with a slowly building sense of doom about the upcoming nuclear holocaust. When the children finally gain access to a bomb shelter, they do not allow a female fellow student join them, claiming there isn't enough room. The girl frantically searches for shelter and finds an abandoned old refrigerator to hide inside, suggesting that she is going to suffocate to death . After a boy from the shelter fails to find her, we hear a loud whining noise overhead. The boy cowers in the shadow of planes passing in the sky above. The film abruptly smashes to black with the words ""STOP! STOP! STOP!"" written on screen. It is left unclear whether or not a bomb is dropped, or the children simply are victims of the panic and paranoia caused by the Cold War.",1963,Yes
675947,"The series of assaults  commenced on May 10, 1969, with the hill finally being taken on May 20. The film portrays fighting, combat, courage, camaraderie and dedication to the mission among troops. It also brings up painful questions about the Vietnam War, such as the stigmatizing of replacement troops  and of the seeming caprice of high command in the conflict, specifically the lack of strategic value of the hill and subsequent unnecessary casualties. Other issues include the effect of anti-war sentiment on morale, and racial tensions among troops . One aspect of the war portrayed is how the soldiers in the field felt betrayed by people back in the United States, particularly college students. In one scene a soldier gets a letter from his girlfriend saying she will not keep writing because her college friends told her it was immoral to be involved with a serviceman whom they refer to as ""killers"". In another scene, Sgt. Worchester ([[Steven Weber  from the South tells his fellow soldiers that when he got home from his first tour of duty in 1968, he faced discrimination for being a veteran. When he got off the plane, hippies threw bags of dog feces at him and other returning soldiers. When he got to his house, his wife was having sex with another man, and had nothing but contempt for him. Everywhere he went, people treated him with hostility and scorn. Incredibly, none of this bothered Worchester until he discovered that his local bartender  had lost his son in the 1965 Battle of Ia Drang Valley and was sent home in ""a rubber bag with 'members missing' labeled on it."" To make it worse, college students kept phoning the bartender at his house saying they were glad his son was killed by ""the heroic people's army"", causing the bartender to suffer a mental breakdown and start using heroin. This event caused the angry and alienated Worchester to sign up for another tour in Vietnam.",1987,Yes
10552268,"During World War II, Wehrmacht Colonel Claus von Stauffenberg  is severely wounded during an RAF air raid in Tunisia, losing a hand and an eye, and is evacuated home to Nazi Germany. Meanwhile, Major General Henning von Tresckow  attempts to assassinate Adolf Hitler by smuggling a bomb aboard the Führer's personal airplane. The bomb, however, is a dud and fails to detonate, and Tresckow flies to Berlin in order to safely retrieve it. After learning that the Gestapo has arrested Major General Hans Oster, he orders General Olbricht  to find a replacement. After recruiting Stauffenberg into the German Resistance, Olbricht presents Stauffenberg at a meeting of the secret committee which has coordinated previous attempts on Hitler's life. The members include General Ludwig Beck , Dr. Carl Goerdeler , and Erwin von Witzleben . Stauffenberg is stunned to learn that no plans exist on the subject of what is to be done after Hitler's assassination. During a bombing raid on Berlin, he gets the idea of using Operation Valkyrie, which involves the deployment of the Reserve Army to maintain order in the event of a national emergency. The plotters carefully redraft the plan's orders so that they can dismantle the Nazi regime after assassinating Hitler. Realizing that only General Friedrich Fromm , the head of the Reserve Army, can initiate Valkyrie, they offer him a position as head of the Wehrmacht in a post-Nazi Germany and request his support, but Fromm declines to be directly involved. With the rewritten Operation Valkyrie orders needing to be signed by Hitler , Stauffenberg visits the Führer at his Berghof estate in Bavaria. In the presence of Dr. Joseph Goebbels, Wilhelm Keitel, Heinrich Himmler, Hermann Göring and Albert Speer, his inner circle, Hitler praises Stauffenberg's heroism in North Africa and signs the orders without fully examining the modifications, believing Stauffenberg's changes ""are for the best"". At Goerdeler's insistence, Stauffenberg is ordered to assassinate both Hitler and SS head Himmler at the Führer's command bunker, the Wolf's Lair. At a final briefing, Colonel Mertz von Quirnheim  instructs the committee members in the use of pencil detonators. Stauffenberg also persuades General Fellgiebel , who controls all communications at Wolf's Lair, to cut off communications after the bomb blast. On July&nbsp;15, 1944, Stauffenberg attends a strategy meeting at Wolf's Lair with the bomb in his briefcase, but with Himmler not present at the meeting, Stauffenberg does not get the go-ahead from the committee leaders, and by the time one of them defies the others and tells him to do it anyway, the meeting is over. Meanwhile, the Reserve Army is mobilized by Olbricht, unbeknownst to Fromm, to stand by. With no action taken, Stauffenberg safely extracts himself and the bomb from the bunker, and the Reserve Army is ordered to stand down, believing that the mobilization was training. Back in Berlin, Olbricht and Stauffenberg are threatened by Fromm that if they try to control the reserve army again he will have them arrested; Stauffenberg goes to the committee to protest their indecisiveness and condemns Goerdeler, who has been selected to be chancellor after the coup. When Goerdeler demands that Stauffenberg be relieved, Beck informs him that the SS is searching for him and implores him to leave the country immediately. On July 20, 1944, Stauffenberg and his adjutant Lieutenant Haeften  return to Wolf's Lair. To Stauffenberg's dismay, he discovers only after the timer has been activated that the conference is being held in an open-window summer barrack, whereas the plotters had intended to detonate the bomb within the walls of the bunker for maximum damage. While his adjuntant waits with the car, Stauffenberg places the briefcase with the bomb armed at the meeting as close to Hitler as possible. Stauffenberg then leaves the barrack, returning to the car. However, one of the officers at the meeting moves the bomb behind a table leg, thereby protecting Hitler from most of the blast. When the bomb explodes, Stauffenberg is certain that Hitler is dead and flees Wolf's Lair. Before shutting down communications, Fellgiebel calls Mertz about the explosion but cannot clearly convey whether or not the Führer is dead. As Stauffenberg flies back to Berlin, Olbricht refuses to mobilize the Reserve Army until he knows without a doubt that Hitler is dead . Behind Olbricht's back, Mertz forges his signature and issues the orders anyway. With Operation Valkyrie underway, Stauffenberg and his fellow plotters order the arrest of Nazi party leaders and SS officers, convincing lower officers that the Party and the SS are staging a coup. As Stauffenberg begins to take control of Berlin's government ministries, mid-level officers relaying the orders begin to wonder which side they should be fighting for. Rumors reach Berlin that Hitler survived the blast, but Stauffenberg dismisses them as SS propaganda. Meanwhile, Fromm learns from Field Marshal Keitel that Hitler is still alive. The General refuses to join the plotters, resulting in them detaining him. Major Otto Ernst Remer of the Reserve Army prepares to arrest Goebbels, but is stopped when Goebbels connects him by phone to Hitler. Immediately recognizing the voice on the other end, Remer realizes that the Reserve Army has been duped—rather than containing a coup, they have unwittingly supported it. SS officers are released and the plotters in turn are besieged inside the Bendlerblock. The headquarters staff flees, but the resistance leaders are arrested. In an ultimately vain effort to save himself, General Fromm convenes an impromptu court martial and sentences the conspirators to death, contravening Hitler's orders that they be kept alive. Given a pistol by Fromm, Beck commits suicide. That night, the ringleaders are then executed by firing squad one by one. When his turn arrives, Colonel Stauffenberg's last act is to cry ""Long live sacred Germany!"" A brief epilogue informs that the conspiracy of July 20th, 1944 was the last of fifteen known assassination attempts on Hitler by Germans. It also mentions Hitler's suicide nine months later and that Countess Nina von Stauffenberg and her children survived the war. The dedication at the Memorial to the German Resistance is then superimposed: You did not bear the shame You resisted By sacrificing your impassioned lives for freedom, justice and honor.",2008,Yes
3153784,"Two teenagers exploring at night come upon an apparently abandoned military installation. They take advantage of what appears to be a swimming pool to skinny dip. The teenagers are attacked by an unseen force and disappear under the water. A light activates in the main building and a silhouetted figure investigates the screams, but is too late to help. A determined but somewhat absent-minded insurance investigator named Maggie McKeown  is dispatched to find the missing teenagers near Lost River Lake. She hires surly backwoods drunkard Paul Grogan  to serve as her guide. They come upon the abandoned compound, which functioned as a fish hatchery prior to being militarized. They discover bizarre specimens in jars and indications of an occupant. Maggie locates the drainage switch for the outside pool and decides to empty it to search the bottom, but the moment she activates it a haggard and frantic man attacks her, attempting to stop the draining until he is subdued by Grogan. The two find a skeleton in the filtration trap of the empty pool, and learn it was filled with salt water. The man awakens and steals their jeep, but crashes it due to his disorientation, and is taken to Grogan's home where they spend the night. They take Grogan's homemade raft down the river, where the man wakes up and tells them that the pool in the facility was filled with a school of piranhas, and that Maggie released them into the river. They are skeptical until they come across the corpse of Grogan's friend Jack , who has bled to death from an attack on a fishing dock. The man reveals himself to be Doctor Robert Hoak ([[Kevin McCarthy , the lead scientist of a defunct Vietnam War project, Operation: Razorteeth, which was tasked with engineering a ravenous and prodigious strain of piranha that could endure the cold water of the North Vietnamese rivers and inhibit Viet Cong movement. The project was shut down when the war ended, but some of the mutant specimens survived the poisoning protocols, and Hoak tended to them to salvage his work. Grogan realizes that if the local dam is opened, The School will have access to the Lost River water park  and summer camp on the other side, where his daughter is in attendance. Traveling downriver, they encounter a capsized canoe with a boy whose father has been killed by the fish. Hoak rescues the boy but suffers mortal injuries when The School attacks him; he dies before he can tell how to kill them. Blood from Hoak's corpse causes the piranha to tear away the raft's lashings, and they barely get to shore. Grogan stops the dam attendant from opening the spillway and calls the military. A military team led by Colonel Waxman ([[Bruce Gordon  and former Razorteeth scientist Dr. Mengers  feed poison into the upstream section, ignoring the protests that the fish survived the first attempt. When Grogan discovers that a tributary bypasses the dam, Waxman and Mengers quarantine them to prevent the agitated pair from alerting the media. When they escape, Waxman alerts law enforcement to capture them. The School attacks the summer camp during a swimming marathon, injuring and killing many children and a supervisor; Grogan's daughter, however, escapes due to her fear of water, and eventually rallies herself to aid her camp mates in escaping the killer fish. The School continues downriver. Waxman and Mengers arrive at the water park to intercept Grogan and Maggie, but the piranha attack the resort and kill a lot of vacationers, including Waxman. Grogan and Maggie commanded a speedboat and rush to the shuttered smelting plant at the narrowest point of the river. Remembering the empty facility pond, Grogan realizes the fish can survive in salt water; if the school passes the delta, they will reach the ocean and spread over the entire world. He intends to open the smelting refuse tanks, hoping that the industrial waste will kill the fish. They arrive at the plant ahead of the fish, but the elevated water level has submerged the control office, and Grogan must go underwater; he ties a rope around his waist and instructs Maggie to count to 100 before pulling him out. Grogan struggles to move the rusted valve wheel when The School arrives and attacks him. The assault hyperadrenalizes him, and he manages to open the valves just as Maggie guns the engine and pulls him to safety. Maggie takes Grogan back to the water park, where a massive MEDEVAC is tending to the victims; his injuries are severe and he is seen in a catatonic state. Mengers gives an on-site television interview, providing a sanitized version of events and downplaying the existence of piranha. Her voice is heard carrying out over a radio on the shore of a West Coast beach. As she says ""there's nothing left to fear"", the piranha's characteristic trilling sound drowns out the waves on a beach, indicating that the fish have made it to the ocean.",1978,Yes
3792976,"Lee Majors, in his first lead acting role, stars as Andy Crocker, a soldier who is wounded in a gun battle in Vietnam. Awarded the Purple Heart, Crocker is sent home to Dallas, Texas where he reunites with his parents . Crocker says that all that kept him going during the trials of Vietnam was his dreams of running a motorcycle racing track and marrying his sweetheart, Lisa . Crocker, however, soon discovers that his friends and loved ones have moved on while he was in Vietnam. Lisa has married another man , and a friend entrusted to take care of the motorcycle track business  has made arrangements to sell it out from under Andy. An attempt at rekindling his relationship with Lisa ends in disaster. Ultimately, Andy finds himself running afoul of Lisa's family , and the law after he punches Mack for betraying him. Fleeing from the Dallas area, Andy eventually finds himself in San Francisco where he briefly reunites with his old army friend David . Afterwards, realizing he has nowhere else to go, he sits down in front of a U.S. Army Recruiting Office and waits for the doors to open. Also appearing in the film is Bobby Hatfield of The Righteous Brothers as a restaurant owner. The title of the film refers to a song  that recurs throughout the film as ""Greek chorus"" to the events unfolding. Singer/songwriter Murray Macleod sang the title song. The Ballad of Andy Crocker has fallen into the public domain in North America{{Citation needed}}, and is widely available on DVD. According to Allmovie, the film was intended as a pilot for a potential weekly series , but no series eventuated.Hal Erickson, Allmovie, quoted at www.mtv.com",1969,Yes
2421352,"Project Questor is the brainchild of the genius Dr. Emil Vaslovik, a Nobel laureate. Vaslovik had developed plans to build a super-human android. A team of the world's foremost experts is able to build the android, even though they do not understand the components with which they are working&nbsp;&mdash; they are only able to follow the instructions, and install the parts, left by Vaslovik, who has disappeared. Attempts to decode the programming tape were worse than merely unsuccessful—they also erased approximately half of the tape's contents. They decide to substitute their own programming, over the objections of Jerome ""Jerry"" Robinson , the only team member who had actually worked with Dr. Vaslovik. He is overruled by the head of the project, Geoffrey Darrow . When the android's body has been finished, the new tape is loaded, but with no apparent results. In desperation, Robinson persuades Darrow to allow Vaslovik's tape&nbsp;&mdash; what remains of it&nbsp;&mdash; to be loaded. Again, the team is disappointed, as there appears to be no response. However, once left alone, the android comes to life. It adds the various cosmetic touches to a previously featureless outer skin, transforming itself from an ""it"" to a ""him,"" and he then leaves the laboratory to visit Vaslovik's office and archives; it is there that he first identifies himself as Questor. The android forces Robinson to accompany him in a search for Vaslovik, with Darrow in pursuit of both, following a minuscule datum in his original programming. Questor  only knows that it has something to do with an ""aquatic vehicle""&nbsp;&mdash; a boat&nbsp;&mdash; and that if he does not find Vaslovik before the end of a countdown, the nuclear generator in his abdomen will overload and explode. Vaslovik had programmed this into him to prevent his creation from being misused, and time is running out. Just as Questor deciphers the clues and tells Robinson that he knows where Vaslovik is, he is shot by British soldiers, and returned to the laboratory. Robinson repairs Questor, and Darrow gives him two options: If Robinson puts a homing transmitter inside the android, they will be given a plane to go find Vaslovik, but if Robinson refuses, the android will simply be flown to a safe location where the explosion will not endanger anyone. Robinson implants the beacon, and they jet off to Mount Ararat&nbsp;&mdash; the ""boat"" imperative had referred to Noah's Ark. Robinson and Questor reach a cave concealed inside Mount Ararat with seconds to spare. Questor's timer is made safe, and he has found Emil Vaslovik , who tells Questor and Robinson that he, too, is an android. Questor is the last of a series, going back to ""the dawn of this world,"" left there by ""Masters"" to serve and protect Mankind. They functioned by a law which Vaslovik quotes to Questor: {{quote}} Each of the Masters' previous androids had a lifespan of several hundred years, at the end of which each assembled its replacement. The unexpected, rapid advent of nuclear physics and the radioactive fallout from above-ground nuclear testing had damaged Vaslovik. Questor's design corrected these failures, and finally Vaslovik is able to die in peace, after asking Robinson to help Questor learn about humanity. Darrow, having followed the pair, has heard enough to know how important it is that Questor be allowed to fulfill his mission. Unfortunately, he has brought the military with him to destroy the android. The cynical Darrow believes that this is proof that humanity does not deserve Questor's help. However, Questor convinces him otherwise. Deciding to sacrifice his own life for Questor's sake, Darrow takes the transmitter and leaves, telling the military commander that not only Vaslovik had gone insane, but also that the android has escaped, and to send in jet fighters when the beacon signal is picked up. He then takes off in the jet that Questor and Robinson had used, turning on the transmitter as he goes so that they will think that the android is aboard. The plane is destroyed, killing Darrow, and Questor and Robinson begin their mission together.",1974,Yes
